{
  "spec_version": "1.0.0",
  "vocab_version": "0.2.0",
  "dokumen_id": "UU-24-2011",
  "status_review": "reviewed",
  "peraturan": {
    "judul": "Undang-Undang Nomor 24 Tahun 2011 tentang Badan Penyelenggara Jaminan Sosial",
    "jenis": "UU",
    "nomor": "24",
    "tahun": "2011",
    "sumber": "https://peraturan.bpk.go.id/Details/39268/uu-no-24-tahun-2011",
    "status": "Diubah",
    "diubah_oleh": [
      "UU-6-2023"
    ]
  },
  "norma": [
    {
      "norm_id": "JAMSOS-PROGRAM",
      "topik": "Jamsos",
      "pasal": "Pasal 6 ayat (2)",
      "iri_individu": "ktn:KetentuanProgramJamsos",
      "jenis": "KetentuanJaminanSosial",
      "kondisi": "Pekerja penerima upah",
      "akibat": "Wajib diikutsertakan dalam JKK JKM JHT JP",
      "parameter": [],
      "bukti": "BPJS Ketenagakerjaan menyelenggarakan JKK JHT JP dan JKM",
      "confidence": 0.95,
      "dasar_keyakinan": "dikutip",
      "catatan": ""
    }
  ],
  "kategori": [],
  "pengali_lembur": [],
  "program_jamsos": [],
  "cakupan": {
    "lengkap": false,
    "pasal_diekstrak": [
      "Pasal 6"
    ],
    "pasal_dilewati": [
      {
        "pasal": "Pasal 1",
        "alasan": "retrofit: belum ditinjau (migrasi data pilot)"
      },
      {
        "pasal": "Pasal 2",
        "alasan": "retrofit: belum ditinjau (migrasi data pilot)"
      },
      {
        "pasal": "Pasal 3",
        "alasan": "retrofit: belum ditinjau (migrasi data pilot)"
      },
      {
        "pasal": "Pasal 4",
        "alasan": "retrofit: belum ditinjau (migrasi data pilot)"
      },
      {
        "pasal": "Pasal 5",
        "alasan": "retrofit: belum ditinjau (migrasi data pilot)"
      },
      {
        "pasal": "Pasal 7",
        "alasan": "retrofit: belum ditinjau (migrasi data pilot)"
      },
      {
        "pasal": "Pasal 8",
        "alasan": "retrofit: belum ditinjau (migrasi data pilot)"
      },
      {
        "pasal": "Pasal 9",
        "alasan": "retrofit: belum ditinjau (migrasi data pilot)"
      },
      {
        "pasal": "Pasal 10",
        "alasan": "retrofit: belum ditinjau (migrasi data pilot)"
      },
      {
        "pasal": "Pasal 11",
        "alasan": "retrofit: belum ditinjau (migrasi data pilot)"
      },
      {
        "pasal": "Pasal 12",
        "alasan": "retrofit: belum ditinjau (migrasi data pilot)"
      },
      {
        "pasal": "Pasal 13",
        "alasan": "retrofit: belum ditinjau (migrasi data pilot)"
      },
      {
        "pasal": "Pasal 14",
        "alasan": "retrofit: belum ditinjau (migrasi data pilot)"
      },
      {
        "pasal": "Pasal 15",
        "alasan": "retrofit: belum ditinjau (migrasi data pilot)"
      },
      {
        "pasal": "Pasal 16",
        "alasan": "retrofit: belum ditinjau (migrasi data pilot)"
      },
      {
        "pasal": "Pasal 17",
        "alasan": "retrofit: belum ditinjau (migrasi data pilot)"
      },
      {
        "pasal": "Pasal 18",
        "alasan": "retrofit: belum ditinjau (migrasi data pilot)"
      },
      {
        "pasal": "Pasal 20",
        "alasan": "retrofit: belum ditinjau (migrasi data pilot)"
      },
      {
        "pasal": "Pasal 21",
        "alasan": "retrofit: belum ditinjau (migrasi data pilot)"
      },
      {
        "pasal": "Pasal 22",
        "alasan": "retrofit: belum ditinjau (migrasi data pilot)"
      },
      {
        "pasal": "Pasal 23",
        "alasan": "retrofit: belum ditinjau (migrasi data pilot)"
      },
      {
        "pasal": "Pasal 24",
        "alasan": "retrofit: belum ditinjau (migrasi data pilot)"
      },
      {
        "pasal": "Pasal 25",
        "alasan": "retrofit: belum ditinjau (migrasi data pilot)"
      },
      {
        "pasal": "Pasal 26",
        "alasan": "retrofit: belum ditinjau (migrasi data pilot)"
      },
      {
        "pasal": "Pasal 27",
        "alasan": "retrofit: belum ditinjau (migrasi data pilot)"
      },
      {
        "pasal": "Pasal 28",
        "alasan": "retrofit: belum ditinjau (migrasi data pilot)"
      },
      {
        "pasal": "Pasal 29",
        "alasan": "retrofit: belum ditinjau (migrasi data pilot)"
      },
      {
        "pasal": "Pasal 30",
        "alasan": "retrofit: belum ditinjau (migrasi data pilot)"
      },
      {
        "pasal": "Pasal 31",
        "alasan": "retrofit: belum ditinjau (migrasi data pilot)"
      },
      {
        "pasal": "Pasal 32",
        "alasan": "retrofit: belum ditinjau (migrasi data pilot)"
      },
      {
        "pasal": "Pasal 33",
        "alasan": "retrofit: belum ditinjau (migrasi data pilot)"
      },
      {
        "pasal": "Pasal 34",
        "alasan": "retrofit: belum ditinjau (migrasi data pilot)"
      },
      {
        "pasal": "Pasal 35",
        "alasan": "retrofit: belum ditinjau (migrasi data pilot)"
      },
      {
        "pasal": "Pasal 36",
        "alasan": "retrofit: belum ditinjau (migrasi data pilot)"
      },
      {
        "pasal": "Pasal 37",
        "alasan": "retrofit: belum ditinjau (migrasi data pilot)"
      },
      {
        "pasal": "Pasal 38",
        "alasan": "retrofit: belum ditinjau (migrasi data pilot)"
      },
      {
        "pasal": "Pasal 39",
        "alasan": "retrofit: belum ditinjau (migrasi data pilot)"
      },
      {
        "pasal": "Pasal 40",
        "alasan": "retrofit: belum ditinjau (migrasi data pilot)"
      },
      {
        "pasal": "Pasal 41",
        "alasan": "retrofit: belum ditinjau (migrasi data pilot)"
      },
      {
        "pasal": "Pasal 42",
        "alasan": "retrofit: belum ditinjau (migrasi data pilot)"
      },
      {
        "pasal": "Pasal 43",
        "alasan": "retrofit: belum ditinjau (migrasi data pilot)"
      },
      {
        "pasal": "Pasal 44",
        "alasan": "retrofit: belum ditinjau (migrasi data pilot)"
      },
      {
        "pasal": "Pasal 45",
        "alasan": "retrofit: belum ditinjau (migrasi data pilot)"
      },
      {
        "pasal": "Pasal 46",
        "alasan": "retrofit: belum ditinjau (migrasi data pilot)"
      },
      {
        "pasal": "Pasal 47",
        "alasan": "retrofit: belum ditinjau (migrasi data pilot)"
      },
      {
        "pasal": "Pasal 48",
        "alasan": "retrofit: belum ditinjau (migrasi data pilot)"
      },
      {
        "pasal": "Pasal 49",
        "alasan": "retrofit: belum ditinjau (migrasi data pilot)"
      },
      {
        "pasal": "Pasal 50",
        "alasan": "retrofit: belum ditinjau (migrasi data pilot)"
      },
      {
        "pasal": "Pasal 51",
        "alasan": "retrofit: belum ditinjau (migrasi data pilot)"
      },
      {
        "pasal": "Pasal 52",
        "alasan": "retrofit: belum ditinjau (migrasi data pilot)"
      },
      {
        "pasal": "Pasal 53",
        "alasan": "retrofit: belum ditinjau (migrasi data pilot)"
      },
      {
        "pasal": "Pasal 54",
        "alasan": "retrofit: belum ditinjau (migrasi data pilot)"
      },
      {
        "pasal": "Pasal 55",
        "alasan": "retrofit: belum ditinjau (migrasi data pilot)"
      },
      {
        "pasal": "Pasal 56",
        "alasan": "retrofit: belum ditinjau (migrasi data pilot)"
      },
      {
        "pasal": "Pasal 57",
        "alasan": "retrofit: belum ditinjau (migrasi data pilot)"
      },
      {
        "pasal": "Pasal 58",
        "alasan": "retrofit: belum ditinjau (migrasi data pilot)"
      },
      {
        "pasal": "Pasal 59",
        "alasan": "retrofit: belum ditinjau (migrasi data pilot)"
      },
      {
        "pasal": "Pasal 60",
        "alasan": "retrofit: belum ditinjau (migrasi data pilot)"
      },
      {
        "pasal": "Pasal 61",
        "alasan": "retrofit: belum ditinjau (migrasi data pilot)"
      },
      {
        "pasal": "Pasal 62",
        "alasan": "retrofit: belum ditinjau (migrasi data pilot)"
      },
      {
        "pasal": "Pasal 63",
        "alasan": "retrofit: belum ditinjau (migrasi data pilot)"
      },
      {
        "pasal": "Pasal 64",
        "alasan": "retrofit: belum ditinjau (migrasi data pilot)"
      },
      {
        "pasal": "Pasal 65",
        "alasan": "retrofit: belum ditinjau (migrasi data pilot)"
      },
      {
        "pasal": "Pasal 66",
        "alasan": "retrofit: belum ditinjau (migrasi data pilot)"
      },
      {
        "pasal": "Pasal 67",
        "alasan": "retrofit: belum ditinjau (migrasi data pilot)"
      },
      {
        "pasal": "Pasal 68",
        "alasan": "retrofit: belum ditinjau (migrasi data pilot)"
      },
      {
        "pasal": "Pasal 69",
        "alasan": "retrofit: belum ditinjau (migrasi data pilot)"
      },
      {
        "pasal": "Pasal 70",
        "alasan": "retrofit: belum ditinjau (migrasi data pilot)"
      },
      {
        "pasal": "Pasal 71",
        "alasan": "retrofit: belum ditinjau (migrasi data pilot)"
      }
    ],
    "catatan": "Retrofit dari data pilot (migrasi ke record); belum ditinjau penuh."
  },
  "tidak_termodelkan": []
}
