{
  "spec_version": "1.0.0",
  "vocab_version": "0.2.0",
  "dokumen_id": "PP-46-2015",
  "status_review": "reviewed",
  "peraturan": {
    "judul": "Peraturan Pemerintah Nomor 46 Tahun 2015 tentang Penyelenggaraan Program Jaminan Hari Tua",
    "jenis": "PP",
    "nomor": "46",
    "tahun": "2015",
    "sumber": "https://peraturan.bpk.go.id/Details/5614/pp-no-46-tahun-2015",
    "status": "Berlaku",
    "diubah_oleh": []
  },
  "norma": [
    {
      "norm_id": "JAMSOS-IURAN-JHT",
      "topik": "Jamsos",
      "pasal": "Pasal 16 ayat (1)",
      "iri_individu": "ktn:KetentuanIuranJHT",
      "jenis": "KetentuanJaminanSosial",
      "kondisi": "Iuran JHT",
      "akibat": "5,7 persen dari upah: 3,7 persen pemberi kerja dan 2 persen pekerja",
      "parameter": [],
      "bukti": "Iuran JHT sebesar 5,7 persen dari Upah",
      "confidence": 0.95,
      "dasar_keyakinan": "dikutip",
      "catatan": ""
    }
  ],
  "kategori": [],
  "pengali_lembur": [],
  "program_jamsos": [
    {
      "program_id": "JHT",
      "nama": "Jaminan Hari Tua",
      "jenis_program": "JHT",
      "tarif_pengusaha_persen": 3.7,
      "tarif_pekerja_persen": 2.0,
      "tarif_total_persen": 5.7,
      "tingkat_risiko": null,
      "pasal": "Pasal 16 ayat (1)",
      "confidence": 0.95,
      "dasar_keyakinan": "dikutip",
      "bukti": "",
      "catatan": ""
    }
  ],
  "cakupan": {
    "lengkap": false,
    "pasal_diekstrak": [
      "Pasal 16"
    ],
    "pasal_dilewati": [
      {
        "pasal": "Pasal 1",
        "alasan": "retrofit: belum ditinjau (migrasi data pilot)"
      },
      {
        "pasal": "Pasal 2",
        "alasan": "retrofit: belum ditinjau (migrasi data pilot)"
      },
      {
        "pasal": "Pasal 3",
        "alasan": "retrofit: belum ditinjau (migrasi data pilot)"
      },
      {
        "pasal": "Pasal 4",
        "alasan": "retrofit: belum ditinjau (migrasi data pilot)"
      },
      {
        "pasal": "Pasal 5",
        "alasan": "retrofit: belum ditinjau (migrasi data pilot)"
      },
      {
        "pasal": "Pasal 6",
        "alasan": "retrofit: belum ditinjau (migrasi data pilot)"
      },
      {
        "pasal": "Pasal 7",
        "alasan": "retrofit: belum ditinjau (migrasi data pilot)"
      },
      {
        "pasal": "Pasal 8",
        "alasan": "retrofit: belum ditinjau (migrasi data pilot)"
      },
      {
        "pasal": "Pasal 9",
        "alasan": "retrofit: belum ditinjau (migrasi data pilot)"
      },
      {
        "pasal": "Pasal 10",
        "alasan": "retrofit: belum ditinjau (migrasi data pilot)"
      },
      {
        "pasal": "Pasal 11",
        "alasan": "retrofit: belum ditinjau (migrasi data pilot)"
      },
      {
        "pasal": "Pasal 12",
        "alasan": "retrofit: belum ditinjau (migrasi data pilot)"
      },
      {
        "pasal": "Pasal 13",
        "alasan": "retrofit: belum ditinjau (migrasi data pilot)"
      },
      {
        "pasal": "Pasal 14",
        "alasan": "retrofit: belum ditinjau (migrasi data pilot)"
      },
      {
        "pasal": "Pasal 15",
        "alasan": "retrofit: belum ditinjau (migrasi data pilot)"
      },
      {
        "pasal": "Pasal 17",
        "alasan": "retrofit: belum ditinjau (migrasi data pilot)"
      },
      {
        "pasal": "Pasal 18",
        "alasan": "retrofit: belum ditinjau (migrasi data pilot)"
      },
      {
        "pasal": "Pasal 19",
        "alasan": "retrofit: belum ditinjau (migrasi data pilot)"
      },
      {
        "pasal": "Pasal 20",
        "alasan": "retrofit: belum ditinjau (migrasi data pilot)"
      },
      {
        "pasal": "Pasal 21",
        "alasan": "retrofit: belum ditinjau (migrasi data pilot)"
      },
      {
        "pasal": "Pasal 22",
        "alasan": "retrofit: belum ditinjau (migrasi data pilot)"
      },
      {
        "pasal": "Pasal 23",
        "alasan": "retrofit: belum ditinjau (migrasi data pilot)"
      },
      {
        "pasal": "Pasal 24",
        "alasan": "retrofit: belum ditinjau (migrasi data pilot)"
      },
      {
        "pasal": "Pasal 25",
        "alasan": "retrofit: belum ditinjau (migrasi data pilot)"
      },
      {
        "pasal": "Pasal 26",
        "alasan": "retrofit: belum ditinjau (migrasi data pilot)"
      },
      {
        "pasal": "Pasal 27",
        "alasan": "retrofit: belum ditinjau (migrasi data pilot)"
      },
      {
        "pasal": "Pasal 28",
        "alasan": "retrofit: belum ditinjau (migrasi data pilot)"
      },
      {
        "pasal": "Pasal 29",
        "alasan": "retrofit: belum ditinjau (migrasi data pilot)"
      },
      {
        "pasal": "Pasal 30",
        "alasan": "retrofit: belum ditinjau (migrasi data pilot)"
      },
      {
        "pasal": "Pasal 31",
        "alasan": "retrofit: belum ditinjau (migrasi data pilot)"
      },
      {
        "pasal": "Pasal 32",
        "alasan": "retrofit: belum ditinjau (migrasi data pilot)"
      },
      {
        "pasal": "Pasal 33",
        "alasan": "retrofit: belum ditinjau (migrasi data pilot)"
      },
      {
        "pasal": "Pasal 34",
        "alasan": "retrofit: belum ditinjau (migrasi data pilot)"
      },
      {
        "pasal": "Pasal 35",
        "alasan": "retrofit: belum ditinjau (migrasi data pilot)"
      },
      {
        "pasal": "Pasal 36",
        "alasan": "retrofit: belum ditinjau (migrasi data pilot)"
      },
      {
        "pasal": "Pasal 37",
        "alasan": "retrofit: belum ditinjau (migrasi data pilot)"
      }
    ],
    "catatan": "Retrofit dari data pilot (migrasi ke record); belum ditinjau penuh."
  },
  "tidak_termodelkan": []
}
