{
  "spec_version": "1.0.0",
  "vocab_version": "0.2.0",
  "dokumen_id": "PP-49-2025",
  "status_review": "reviewed",
  "peraturan": {
    "judul": "Peraturan Pemerintah Nomor 49 Tahun 2025 tentang Perubahan Kedua atas Peraturan Pemerintah Nomor 36 Tahun 2021 tentang Pengupahan",
    "jenis": "PP",
    "nomor": "49",
    "tahun": "2025",
    "sumber": "https://peraturan.bpk.go.id/Details/339037/pp-no-49-tahun-2025",
    "status": "Berlaku",
    "diubah_oleh": []
  },
  "norma": [],
  "kategori": [],
  "pengali_lembur": [],
  "program_jamsos": [],
  "cakupan": {
    "lengkap": false,
    "pasal_diekstrak": [],
    "pasal_dilewati": [
      {
        "pasal": "Pasal 5",
        "alasan": "retrofit: belum ditinjau (migrasi data pilot)"
      },
      {
        "pasal": "Pasal 26",
        "alasan": "retrofit: belum ditinjau (migrasi data pilot)"
      },
      {
        "pasal": "Pasal 27",
        "alasan": "retrofit: belum ditinjau (migrasi data pilot)"
      },
      {
        "pasal": "Pasal 28",
        "alasan": "retrofit: belum ditinjau (migrasi data pilot)"
      },
      {
        "pasal": "Pasal 34",
        "alasan": "retrofit: belum ditinjau (migrasi data pilot)"
      },
      {
        "pasal": "Pasal 35",
        "alasan": "retrofit: belum ditinjau (migrasi data pilot)"
      },
      {
        "pasal": "Pasal 35A",
        "alasan": "retrofit: belum ditinjau (migrasi data pilot)"
      },
      {
        "pasal": "Pasal 35B",
        "alasan": "retrofit: belum ditinjau (migrasi data pilot)"
      },
      {
        "pasal": "Pasal 35C",
        "alasan": "retrofit: belum ditinjau (migrasi data pilot)"
      },
      {
        "pasal": "Pasal 35D",
        "alasan": "retrofit: belum ditinjau (migrasi data pilot)"
      },
      {
        "pasal": "Pasal 35E",
        "alasan": "retrofit: belum ditinjau (migrasi data pilot)"
      },
      {
        "pasal": "Pasal 35G",
        "alasan": "retrofit: belum ditinjau (migrasi data pilot)"
      },
      {
        "pasal": "Pasal 35H",
        "alasan": "retrofit: belum ditinjau (migrasi data pilot)"
      },
      {
        "pasal": "Pasal 35J",
        "alasan": "retrofit: belum ditinjau (migrasi data pilot)"
      },
      {
        "pasal": "Pasal 6",
        "alasan": "retrofit: belum ditinjau (migrasi data pilot)"
      },
      {
        "pasal": "Pasal 21",
        "alasan": "retrofit: belum ditinjau (migrasi data pilot)"
      }
    ],
    "catatan": "Retrofit dari data pilot (migrasi ke record); belum ditinjau penuh."
  },
  "tidak_termodelkan": []
}
